{
  "capabilities": {
    "fin.crypto.candles": {
      "admitted": false,
      "age_seconds": 2612,
      "reason": null,
      "severity": "INFO",
      "status": "QUALIFIED",
      "tool_name": "crypto_candles"
    },
    "fin.crypto.funding": {
      "admitted": false,
      "age_seconds": 39,
      "reason": null,
      "severity": "DEGRADED",
      "status": "QUALIFIED",
      "tool_name": "crypto_funding_rate"
    },
    "fin.crypto.index_candles": {
      "admitted": false,
      "age_seconds": 2617,
      "reason": null,
      "severity": "INFO",
      "status": "QUALIFIED",
      "tool_name": "crypto_index_candles"
    },
    "fin.crypto.instrument_discovery": {
      "admitted": false,
      "age_seconds": null,
      "reason": "response_schema_and_freshness_contract_unregistered",
      "severity": "DEGRADED",
      "status": "BLOCKED",
      "tool_name": "crypto_list_instruments"
    },
    "fin.crypto.long_short_ratio": {
      "admitted": false,
      "age_seconds": 165,
      "reason": null,
      "severity": "DEGRADED",
      "status": "QUALIFIED",
      "tool_name": "crypto_long_short_ratio"
    },
    "fin.crypto.mark_price": {
      "admitted": false,
      "age_seconds": 1,
      "reason": null,
      "severity": "DEGRADED",
      "status": "QUALIFIED",
      "tool_name": "crypto_mark_price"
    },
    "fin.crypto.open_interest": {
      "admitted": false,
      "age_seconds": 1,
      "reason": null,
      "severity": "DEGRADED",
      "status": "QUALIFIED",
      "tool_name": "crypto_open_interest"
    },
    "fin.crypto.orderbook": {
      "admitted": false,
      "age_seconds": 1,
      "reason": null,
      "severity": "INFO",
      "status": "QUALIFIED",
      "tool_name": "crypto_orderbook"
    },
    "fin.crypto.recent_trades": {
      "admitted": false,
      "age_seconds": 2,
      "reason": null,
      "severity": "INFO",
      "status": "QUALIFIED",
      "tool_name": "crypto_recent_trades"
    },
    "fin.crypto.ticker": {
      "admitted": false,
      "age_seconds": 2,
      "reason": null,
      "severity": "DEGRADED",
      "status": "QUALIFIED",
      "tool_name": "crypto_ticker"
    }
  },
  "capability_policy_digest": "sha256:d83654d47338033d9e62b0c7e5bd59bd2c5f0240fbb68d771859c7ed0b425503",
  "deployment_id": "dep-datvbjflk1mc73d3pitg",
  "endpoint_reason": null,
  "endpoint_status": "AVAILABLE",
  "endpoint_url": "https://fin-data-mcp-http-v02-prod.onrender.com/mcp",
  "fallback": "NONE",
  "health_severity": "DEGRADED",
  "identity_digest": "sha256:8aa8fd9ae616769286e1646944fbd519c6d2aeeeb392707723e85e20c3aec379",
  "ledger_digest": "sha256:d66f6b5e74a31758bbc083def46925f538df4da70690bf824b31a6ad8929bed5",
  "ledger_errors": [],
  "observed_at": "2026-09-30T02:56:39Z",
  "observed_endpoint_url": "https://fin-data-mcp-http-v02-prod.onrender.com/mcp",
  "response_contract_policy_digest": "sha256:02d399566b614482993a4b193b87c3203de8341aa0f862696a9853de01e63f36",
  "schema_version": "1.0",
  "snapshot_digest": "sha256:bf5033004c548664987ef49ae3515589e3d2b4637d4fe964c2eb409170c7bee6",
  "source_id": "fin_data_mcp_render_prod",
  "status": "DEGRADED"
}
